{"$defs":{"NormalizedPoint":{"additionalProperties":false,"properties":{"x":{"maximum":1,"minimum":0,"title":"X","type":"number"},"y":{"maximum":1,"minimum":0,"title":"Y","type":"number"}},"required":["x","y"],"title":"NormalizedPoint","type":"object"},"ProviderCharacterCaption":{"additionalProperties":false,"properties":{"center":{"$ref":"#/$defs/NormalizedPoint"},"character_id":{"format":"uuid","title":"Character Id","type":"string"},"negative_tags":{"items":{"type":"string"},"maxItems":120,"minItems":1,"title":"Negative Tags","type":"array"},"order":{"maximum":19,"minimum":0,"title":"Order","type":"integer"},"positive_tags":{"items":{"type":"string"},"maxItems":120,"minItems":1,"title":"Positive Tags","type":"array"}},"required":["character_id","order","center","positive_tags","negative_tags"],"title":"ProviderCharacterCaption","type":"object"}},"$id":"https://manga-maker.local/contracts/v0.3/provider-execution-spec.schema.json","$schema":"https://json-schema.org/draft/2020-12/schema","additionalProperties":false,"properties":{"action":{"default":"generate","enum":["generate","infill"],"title":"Action","type":"string"},"base_narrative":{"anyOf":[{"maxLength":12000,"minLength":1,"type":"string"},{"type":"null"}],"default":null,"title":"Base Narrative"},"base_negative_tags":{"items":{"type":"string"},"maxItems":200,"minItems":1,"title":"Base Negative Tags","type":"array"},"base_positive_tags":{"items":{"type":"string"},"maxItems":200,"minItems":1,"title":"Base Positive Tags","type":"array"},"capability_snapshot_sha256":{"pattern":"^[0-9a-f]{64}$","title":"Capability Snapshot Sha256","type":"string"},"character_captions":{"items":{"$ref":"#/$defs/ProviderCharacterCaption"},"maxItems":3,"title":"Character Captions","type":"array"},"contract_sha256":{"pattern":"^[0-9a-f]{64}$","title":"Contract Sha256","type":"string"},"generation_scope":{"default":"panel","enum":["panel","full_page"],"title":"Generation Scope","type":"string"},"generation_spec_id":{"format":"uuid","title":"Generation Spec Id","type":"string"},"height":{"maximum":4096,"minimum":64,"title":"Height","type":"integer"},"mapping_version":{"maxLength":100,"minLength":1,"title":"Mapping Version","type":"string"},"model_id":{"maxLength":100,"minLength":1,"title":"Model Id","type":"string"},"page_layout_draft_id":{"format":"uuid","title":"Page Layout Draft Id","type":"string"},"page_layout_draft_sha256":{"pattern":"^[0-9a-f]{64}$","title":"Page Layout Draft Sha256","type":"string"},"page_layout_draft_version":{"minimum":1,"title":"Page Layout Draft Version","type":"integer"},"payload_sha256":{"pattern":"^[0-9a-f]{64}$","title":"Payload Sha256","type":"string"},"prompt_plan_id":{"format":"uuid","title":"Prompt Plan Id","type":"string"},"prompt_plan_sha256":{"pattern":"^[0-9a-f]{64}$","title":"Prompt Plan Sha256","type":"string"},"prompt_plan_version":{"minimum":1,"title":"Prompt Plan Version","type":"integer"},"provider":{"const":"novelai","default":"novelai","title":"Provider","type":"string"},"provider_execution_spec_id":{"format":"uuid","title":"Provider Execution Spec Id","type":"string"},"schema_version":{"const":"1.0","default":"1.0","title":"Schema Version","type":"string"},"seed":{"maximum":4294967295,"minimum":0,"title":"Seed","type":"integer"},"version":{"minimum":1,"title":"Version","type":"integer"},"width":{"maximum":4096,"minimum":64,"title":"Width","type":"integer"}},"required":["provider_execution_spec_id","version","generation_spec_id","mapping_version","contract_sha256","capability_snapshot_sha256","model_id","prompt_plan_id","prompt_plan_version","prompt_plan_sha256","page_layout_draft_id","page_layout_draft_version","page_layout_draft_sha256","width","height","seed","base_positive_tags","base_negative_tags","payload_sha256"],"title":"ProviderExecutionSpec","type":"object"}
