{
  "schema_version": "1.0",
  "provider_execution_spec_id": "01900000-0000-7000-8000-000000000601",
  "version": 1,
  "generation_spec_id": "01900000-0000-7000-8000-000000000602",
  "provider": "novelai",
  "action": "generate",
  "mapping_version": "novelai-image-2026-09-06.5-explicit-uc-1",
  "contract_sha256": "2bd3c5fcd491016e1951f5a3f347d0207d49d4add153899405224e21fd1dc684",
  "capability_snapshot_sha256": "abababababababababababababababababababababababababababababababab",
  "model_id": "nai-diffusion-5-full",
  "prompt_plan_id": "01900000-0000-7000-8000-000000000202",
  "prompt_plan_version": 1,
  "prompt_plan_sha256": "cccccccccccccccccccccccccccccccccccccccccccccccccccccccccccccccc",
  "page_layout_draft_id": "01900000-0000-7000-8000-000000000001",
  "page_layout_draft_version": 1,
  "page_layout_draft_sha256": "aaaaaaaaaaaaaaaaaaaaaaaaaaaaaaaaaaaaaaaaaaaaaaaaaaaaaaaaaaaaaaaa",
  "width": 1216,
  "height": 896,
  "seed": 424242,
  "base_positive_tags": ["2girls", "night street", "wide shot", "black and white manga"],
  "base_negative_tags": ["text", "watermark", "logo"],
  "character_captions": [
    {
      "character_id": "01900000-0000-7000-8000-000000000301",
      "order": 0,
      "center": {"x": 0.3, "y": 0.56},
      "positive_tags": ["black bob hair", "white trench coat", "offering a brass key"],
      "negative_tags": ["wrong hair color", "wrong outfit"]
    },
    {
      "character_id": "01900000-0000-7000-8000-000000000302",
      "order": 1,
      "center": {"x": 0.7, "y": 0.56},
      "positive_tags": ["long silver hair", "dark school uniform", "receiving a brass key"],
      "negative_tags": ["short hair", "white coat"]
    }
  ],
  "payload_sha256": "eeeeeeeeeeeeeeeeeeeeeeeeeeeeeeeeeeeeeeeeeeeeeeeeeeeeeeeeeeeeeeee"
}
